entity_name,entity_type,description,entity_id,summary
醇贤亲王,Person,清朝光绪三十二年的旧历正月十四出生于北京的醇王府的第一代醇王,8cadf343-b64f-4eff-9b75-15d7b963031f,The first-generation Prince Chun of the Qing Dynasty was born in the Prince Chun's Mansion in Beijing in January 1906.
醇王府,Location,曾占据过三处地方，分别位于宣武门内的太平湖东岸、什刹后海、北京,f01a5b35-bfdb-4720-b714-ca92e8e6de18,醇王府位于北京。
慈禧太后,Person,醇贤亲王奕讠瞏的儿媳妇，光绪皇帝的姨母，清朝的第十代皇帝宣统的养母,94eaa95b-fc59-418a-bca5-ddbf953bf9af,慈禧太后是醇贤亲王奕讠瞏的儿媳妇，光绪皇帝的姨母，也是清朝的第十代皇帝宣统的养母。
光绪皇帝,Person,醇贤亲王奕讠瞏的儿子，慈禧太后的亲生子，清朝的第十代皇帝宣统的堂兄弟,b806f3ab-849b-489c-a022-bfd23ed0a5c7,光绪皇帝是慈禧太后的亲生子，醇贤亲王奕讠瞏的儿子，宣统的堂兄弟。
宣统皇帝,Person,清朝的第十代，也是最末一代的皇帝，年号宣统，在三岁那年的旧历十月二十日被慈禧太后和光绪皇帝立为嗣皇帝，承继同治，兼祧光绪,4715b786-8a65-4f72-9135-fb41124c2922,宣统皇帝是清朝的最后一位皇帝。
